,post_id,title,url,comment_count,vote_count,published_date
98,39056060,แชร์ประสบการณ์ที่ลำบากสุดๆในชีวิตกันค่ะ ตอนนี้เรารู้สึกว่าลำบากมากเลย,https://pantip.com/topic/39056060,166,1,2019-07-15T11:40:00.000000+0642
99,39205921,ได้งานราชการตอนอายุ 44 ไม่มีเงินเก็บ มีภาระหนี้สินคำนวณแล้วต้องติดลบ แต่อนาคตมั่นคงควรทำมั้ย,https://pantip.com/topic/39205921,108,1,2019-09-06T03:27:00.000000+0642
100,31387757,[แรงบันดาลใจ]จากความฝันสู่ความจริง (มีเงิน 5 ล้านก่อนอายุ 25),https://pantip.com/topic/31387757,93,141,2013-12-15T14:44:00.000000+0642
101,37341871,มาแชร์ประสบการณ์ การลาออก แบบไม่มีงานรองรับครั้งแรกของชีวิต,https://pantip.com/topic/37341871,62,79,2018-02-03T09:35:00.000000+0642
102,36138454,ทำไมเวลาเพื่อนขอติดรถเรากลับบ้านบ่อยๆ เราถึงรู้สึกว่าถูกเอาเปรียบ ทั้งที่เราก็ต้องไปที่นั่นอยู่แล้ว,https://pantip.com/topic/36138454,180,21,2017-02-22T10:38:00.000000+0642
103,37140478,ผมรายได้หลักแสน+นั่งกินร้านตามสั่งริมทาง(ทุกวัน) /พนักงานเซเว่นได้ ชมละ40บ ก็นั่งกินร้านเดียวกัน/ผมรู้สึกมีบางอย่างแปลกๆ,https://pantip.com/topic/37140478,457,17,2017-11-30T09:38:00.000000+0642
104,39927228,ขออนุญาต Share Lifestyle ของคนรายได้ประมาณ 2 แสนต่อเดือนนะครับ คิดว่าน่าจะมีคนอยากรู้(เพราะผมเองก็อยากรู้ของคนอื่น555),https://pantip.com/topic/39927228,108,2,2020-05-25T13:30:00.000000+0642
105,40896738,คนรวยแบบไม่ทำงานก็ได้ คิดลาออกจากงานช่วง covid ไหมครับ,https://pantip.com/topic/40896738,58,0,2021-08-08T17:56:00.000000+0642
106,40905068,ไปทำงานแล้วเคยร้องไห้เรื่องอะไรบ้าง,https://pantip.com/topic/40905068,55,1,2021-08-12T10:48:00.000000+0642
107,35134343,จากเด็กเรียนไม่เก่ง บ้านไม่รวย จนมาเป็นสถาปนิกที่อเมริกา (ไม่ง่ายเลย...),https://pantip.com/topic/35134343,164,174,2016-05-09T04:02:00.000000+0642
108,39904516,เก็บเงินได้เท่าไหร่ถึงเลิกทำงานประจำกันครับ ?,https://pantip.com/topic/39904516,61,0,2020-05-17T11:15:00.000000+0642
109,36579962,โดนหัวหน้าด่าโทษฐานไม่อ่านไลน์กรุ๊ปบริษัทในวันหยุด,https://pantip.com/topic/36579962,153,57,2017-06-18T20:26:00.000000+0642
110,40898646,ในยุคที่เศรษฐกิจไม่ดี คุณวางแผนการใช้เงินยังไงให้อยู่รอด?,https://pantip.com/topic/40898646,54,0,2021-08-09T14:06:00.000000+0642
111,35913224,เคยไม่มีตัง กินข้าวไหม จะไปยืมใครก็เกรงใจ ต้องมีกลวิธี เอาชีวิตรอด ผ่านกันมาได้อย่างไร?,https://pantip.com/topic/35913224,192,44,2016-12-15T02:18:00.000000+0642
112,35821104,มีใครนอนแค่3-4ชม.ต่อวันแล้วเพียงพอ ไปทำงานทั้งวันสบายๆไม่ง่วงบ้าง ทำได้อย่างไร อยากทำได้บ้าง จะมีเวลาเพิ่มขึ้นเยอะเลย?,https://pantip.com/topic/35821104,123,0,2016-11-18T02:12:00.000000+0642
113,32532547,"〈บ่น〉ต้องรับราชการเท่านั้นหรือถึงจะเรียกว่า ""มั่นคง""",https://pantip.com/topic/32532547,140,46,2014-09-03T09:57:00.000000+0642
114,36593238,คุ้มมั้ยกับการไปอยู่ Singapore,https://pantip.com/topic/36593238,59,0,2017-06-22T18:32:00.000000+0642
115,40890575,"แล้ววันนี้ก็มาถึง บริษัทไปต่อไม่ไหว ""ตกงานแล้วเรา""",https://pantip.com/topic/40890575,89,21,2021-08-05T21:49:00.000000+0642
116,33052421,"คู่มือ แฉ แบไต๋ ""ซื้อประกัน"" อย่างคุ้มค่าและไร้กังวล {ลูกค้าอ่านดี ตัวแทนอ่านได้}",https://pantip.com/topic/33052421,61,123,2015-01-02T14:00:00.000000+0642
117,40860621,เราคือบุคคลากรทางการแพทย์ที่เหนื่อยและท้อกับงานจนคิดว่าจะต้องลาออกแล้ว,https://pantip.com/topic/40860621,168,98,2021-07-23T21:10:00.000000+0642
118,30765122,ถ้าคุณเจอหัวหน้าที่พูดจากไม่ดีใส่คุณ คุณจะทำยังไง,https://pantip.com/topic/30765122,52,0,2013-07-26T12:50:00.000000+0642
119,40874239,คนกรุงเทพในช่วงโควิดระบาดหนักแบบนี้ใช้ชีวิตกันอย่างไร ลำบากไหม,https://pantip.com/topic/40874239,52,1,2021-07-29T23:46:00.000000+0642
120,40875134,"วิธีเก็บเงินให้ได้3,000,000 ภายใน6ปี ของมนุษย์เงินเดือน",https://pantip.com/topic/40875134,78,0,2021-07-30T12:46:00.000000+0642
121,37274721,"เด็กๆที่ชนะในรายการ ""ไอคิว180"" ตอนนี้ทำอาชีพอะไรกัน",https://pantip.com/topic/37274721,110,73,2018-01-13T07:37:00.000000+0642
122,40879012,จริงหรอที่ปี 2020-2021 คนไทยตกงานมากสุดเป็นประวัติการณ์(มากกว่าปีต้มยำกุ้งหรือปีไหนๆที่ผ่านมา),https://pantip.com/topic/40879012,56,0,2021-08-01T05:42:00.000000+0642
123,40249092,"""ออมเงินให้ตายก็ไม่รวย ถ้าไม่ลงทุน"" คำพูดนี้จริงแค่ไหนครับ",https://pantip.com/topic/40249092,80,2,2020-10-09T14:29:00.000000+0642
124,38484046,ใครเคยออกจากงานมาโดยไม่มีงานใหม่รองรับ ออกมาอยู่บ้านเฉยๆบ้างครับ แล้วระหว่างนั้นทำอะไร รู้สึกอย่างไรบ้าง,https://pantip.com/topic/38484046,91,1,2019-01-22T19:56:00.000000+0642
125,40868891,ถามคนที่โสดมานาน เวลาที่คุณเสียใจหรือทุกข์ใจ คุณผ่านมันมาได้ยังไงกันคะ,https://pantip.com/topic/40868891,123,9,2021-07-27T19:18:00.000000+0642
126,35165122,อะไรคือการบ่งบอกว่าเราเป็น ผู้ใหญ่ มากขึ้น ? (ถ้าไม่ได้ดูที่อายุ),https://pantip.com/topic/35165122,54,0,2016-05-16T20:53:00.000000+0642
127,40765303,เหตุผลอะไรที่คนมีอาชีพมีงานทำแล้วจะไม่ส่งเงินให้พ่อแม่,https://pantip.com/topic/40765303,74,0,2021-06-09T12:08:00.000000+0642
128,40867216,สมัครงานวิศวกร แต่พอเริ่มงานให้เป็นลูกมือช่างธรรมดา,https://pantip.com/topic/40867216,94,1,2021-07-27T01:09:00.000000+0642
129,39044815,ถามประสบการณ์ของคนที่ลาออกจากงานประจำ แล้วกลับไปอยู่บ้านต่างจังหวัด,https://pantip.com/topic/39044815,93,5,2019-07-11T11:31:00.000000+0642
130,32173651,จริงหรือคะ ? คนที่ทำงานที่การไฟฟ้า ไม่ต้องเสียค่าไฟ,https://pantip.com/topic/32173651,117,5,2014-06-10T18:16:00.000000+0642
131,40228873,ยังเชื่อว่าทำงานราชการดีกว่าเอกชนมั้ย,https://pantip.com/topic/40228873,112,0,2020-09-29T16:50:00.000000+0642
132,40862163,งานที่คุณทำอยู่เป็นงานในฝันของคุณหรือไม่?,https://pantip.com/topic/40862163,76,0,2021-07-24T17:15:00.000000+0642
133,40016241,ตอนเด็กไม่มีใครบอกเลยว่าชีวิตวัยทำงานมันจะหนักหนาสาหัสถึงเพียงนี้,https://pantip.com/topic/40016241,110,13,2020-06-27T00:51:00.000000+0642
134,34332801,แชร์ประสบการณ์ : 9 ปีกับโปรแกรมเมอร์ สู่พ่อค้าก๋วยเตี๋ยวเรือ ;,https://pantip.com/topic/34332801,104,106,2015-10-19T17:24:00.000000+0642
135,40647085,Work From Home ในช่วงโควิดนี้ .... พนักงานสบายขึ้น และนายจ้างเสียประโยชน์นิดๆ ใช่หรือไม่?,https://pantip.com/topic/40647085,52,0,2021-04-17T06:48:00.000000+0642
136,39904329,อยากรู้ว่าพี่ๆ อายุ30-35 ปี มีเงินเก็บกันเท่าไรและมีทรัพย์สินอะไรบ้างแล้ว,https://pantip.com/topic/39904329,115,2,2020-05-17T09:39:00.000000+0642
137,40656023,"ถ้าให้เลือกทำงาน บจก เงิน 70,000 กับ ขายข้าวแกง 100,000 เลือกอันไหนครับ",https://pantip.com/topic/40656023,130,0,2021-04-21T11:09:00.000000+0642
138,32354918,มีเรื่องสงสัยเกี่ยวกับเศรษฐี เค้าใช้เงินกันยังไง มีวันหมดไหมครับ,https://pantip.com/topic/32354918,92,6,2014-07-21T22:01:00.000000+0642
139,40847053,ทำยังไงให้พ่อแม่เลิกถามเรื่องเงินเดือนเพราะท่านชอบเจ้ากี้เจ้าการเงินของเรา,https://pantip.com/topic/40847053,82,3,2021-07-17T14:45:00.000000+0642
140,35246312,[SR] อยากรวยทำไมต้องไปจีน! รีวิวกวางโจว-เซินเจิ้น แบบจัดเต็ม เริ่มทำธุรกิจง่ายๆ ได้ด้วยตัวเอง,https://pantip.com/topic/35246312,54,22,2016-06-07T22:43:00.000000+0642
141,40827204,คนวัยสามสิบต้นๆ เงินเดือนแสน สองแสน ไม่มีภาระ แต่ไม่มีเงินเก็บเลยนี่ปรกติมั้ยคับ,https://pantip.com/topic/40827204,60,2,2021-07-08T00:26:00.000000+0642
142,40833639,เคยตื่นขึ้นมาแล้วไม่อยากไปทำงานมั้ยครับ,https://pantip.com/topic/40833639,72,0,2021-07-11T07:11:00.000000+0642
143,39655385,เศรษฐกิจแบบนี้ อาชีพรับราชการรอด ส่วนเอกชนเน่ากันหมดแล้ว,https://pantip.com/topic/39655385,94,3,2020-02-21T07:31:00.000000+0642
144,31972137,หญิงไทย ไม่แพ้ชาติใดในโลก !!!,https://pantip.com/topic/31972137,70,315,2014-04-27T16:25:00.000000+0642
145,38629448,เตือนใจ น้องๆวัยเริ่มทำงาน แชร์ประสบการณ์ความเป็นหนี้ในวัย 30++,https://pantip.com/topic/38629448,96,149,2019-03-07T16:29:00.000000+0642
146,34519070,ใครเงินเดือนสูงแล้วยังขึ้นมอไซค์ รถเมล์ รถไฟฟ้า ไปทำงานอยู่บ้างคะ,https://pantip.com/topic/34519070,210,2,2015-12-04T11:32:00.000000+0642
147,36528128,พอมีตังค์ แต่ไม่กล้าซื้อรถ มีใครเป็นงี้ไหม?,https://pantip.com/topic/36528128,109,13,2017-06-03T21:07:00.000000+0642
148,35206093,ฉันไม่ได้บ้า แค่กล้าออกมาทำตามความฝัน กับเกษตรพอเพียง 180 ตารางวา,https://pantip.com/topic/35206093,196,153,2016-05-27T18:48:00.000000+0642
149,38127319,ทำงานครบ8ชั่วโมงเด้งกลับบ้าน เจ้านายบอกว่าไม่ทุ่มเทให้บริษัท !!!,https://pantip.com/topic/38127319,87,95,2018-10-05T09:20:00.000000+0642
150,40834806,“เศรษฐกิจวิกฤตแบบนี้” ยังซื้อของฟุ่มเฟือยกันอยู่ไหมครับ..,https://pantip.com/topic/40834806,182,2,2021-07-11T19:46:00.000000+0642
151,36506001,อายุ30กว่า ยังไม่มีเงินเก็บ ใช้ชีวิตแบบเดือนชนเดือน มีใครเป็นแบบนี้บ้างไหมคะ,https://pantip.com/topic/36506001,119,2,2017-05-28T15:24:00.000000+0642
152,40832038,ผู้หญิงสวยๆมีข้อได้เปรียบในชีวิตเยอะจัง แล้วยิ่งในยุคโซเชียล ยิ่งมากขึ้นไปอีก ในขณะที่คนหน้าตาไม่สวยต้อง.. คิดว่าจริงไหม,https://pantip.com/topic/40832038,73,0,2021-07-10T11:53:00.000000+0642
153,40829676,ถ้าตอนนี้มีเงิน 10 ล้าน ท่านจะออกจากงานประจำปัจจุบันมั้ย,https://pantip.com/topic/40829676,149,0,2021-07-09T09:17:00.000000+0642
154,32782231,ทำไมคนชอบเรียนกันจัง นิติศาสตร์ ทั้งที่หางานยาก ตกงานเยอะ,https://pantip.com/topic/32782231,67,8,2014-10-29T17:19:00.000000+0642
155,40817009,"ผมควรรู้สึกอย่างไร ที่ต้องเข้าออฟฟิศเพื่อไปทำงานให้คนที่ ""WFH""",https://pantip.com/topic/40817009,113,26,2021-07-03T00:53:00.000000+0642
156,36691970,ที่ออฟฟิตเลิกงานเลท(เกินเวลา) จนเป็นวัฒนธรรมองค์กร,https://pantip.com/topic/36691970,300,98,2017-07-22T21:22:00.000000+0642
157,40818766,(40+) มีใครเคยไม่อยากตรวจสุขภาพ(ประจำปี?) เพราะกลัวจะรู้ว่าตัวเองเป็นโรคอะไร อมโรคอะไรไว้บ้าง ไหมคะ,https://pantip.com/topic/40818766,60,0,2021-07-03T22:37:00.000000+0642
158,39643916,เพิ่งย้ายงานใหม่ได้1เดือน..รู้สึกเหมือนตัดสินใจผิดพลาด ควรวางแผนสำรองอย่างไรต่อไปดี ?,https://pantip.com/topic/39643916,63,0,2020-02-16T20:13:00.000000+0642
159,39265043,อายุ 35 แล้ว ยังไม่มีบ้าน ไม่มีรถยนต์ ไม่มีแฟน และก็ไม่มีเงินเก็บ ทำไงดี,https://pantip.com/topic/39265043,84,0,2019-09-26T23:18:00.000000+0642
160,40808446,เหนื่อยกับการใช้หนี้บัตร เหมือนทำงานฟรี ชีวิตไม่มีความสุขเลย,https://pantip.com/topic/40808446,122,0,2021-06-29T09:56:00.000000+0642
161,40568536,(ครั้งแรกในชีวิต) กำลังจะซื้อคอนโดกลางปีนี้ ............ รบกวนขอคำแนะนำหน่อยครับ สำหรับมนุษย์เงินเดือน,https://pantip.com/topic/40568536,51,1,2021-03-08T22:45:00.000000+0642
162,40801502,ถ้าย้อนเวลากลับไปได้ จะแก้ไขเรื่องอะไร? และจะบอกอะไรกับตัวเองครับ?,https://pantip.com/topic/40801502,72,1,2021-06-25T22:37:00.000000+0642
163,40162600,แชร์วิธีเก็บเงิน ครึ่งล้านนนนนนน ภายใน 2 ปี ของผู้ชายธรรมดาคนนึง,https://pantip.com/topic/40162600,60,29,2020-08-29T19:41:00.000000+0642
164,38529369,มาเปลี่ยนสายงานอาชีพเอาตอน 40 ใครเป็นแบบผมบ้าง,https://pantip.com/topic/38529369,51,5,2019-02-06T09:48:00.000000+0642
165,37509175,รีวิวประสบการณ์การทำงาน 1 ปีแรกหลังเรียนจบ,https://pantip.com/topic/37509175,53,16,2018-03-28T16:37:00.000000+0642
166,40797308,ตลกดีนะครับ ผมอายุ30+ ยังขัดแย้งกับพ่อแม่เรื่องอยากให้รับราชการ,https://pantip.com/topic/40797308,85,3,2021-06-24T00:28:00.000000+0642
167,32387321,เจ้านานสั่งห้ามฟังเพลงขณะทำงาน ถือว่าละเมิดมั้ยคะ,https://pantip.com/topic/32387321,128,2,2014-07-29T13:24:00.000000+0642
168,40795959,มันแปลกไหมคะที่เราแค่อยากลาออกมานอนพักเฉยๆ,https://pantip.com/topic/40795959,80,5,2021-06-23T13:47:00.000000+0642
169,40782859,ยิ้มๆ เชิงขำๆ กับตัวเองที่มีเงินเก็บส่วนตัว 1 ล้านแรกเมื่ออายุย่าง 63 ปีเพราะหา passive incom จากบ้านเช่า,https://pantip.com/topic/40782859,55,84,2021-06-17T13:05:00.000000+0642
170,40796553,ตอนนี้อายุ 24 ควรซื้อผ่อนบ้าน ทิ้งไว้ดีไหม รอไปอยู่เกษียณ,https://pantip.com/topic/40796553,79,0,2021-06-23T18:29:00.000000+0642
171,40786886,ช่วยส่งหลานเรียนจนจบ มีงานทำ พูดเตือนแค่ครั้งเดียว โกรธไม่ยอมพูดด้วยเป็นปีแล้ว 😢,https://pantip.com/topic/40786886,202,23,2021-06-19T09:29:00.000000+0642
172,40791805,ผู้ชายต้องการความมั่นคงของผู้หญิงมั้ยคะ,https://pantip.com/topic/40791805,94,3,2021-06-21T16:10:00.000000+0642
173,40780274,มีอาชีพอะไรที่ไม่ต้องทำงานกับคน หรือเจอคนน้อยที่สุดบ้าง,https://pantip.com/topic/40780274,106,5,2021-06-16T09:35:00.000000+0642
174,38311535,ครั้งหนึ่งในชีวิต... ฉันเคยเป็นวิศวกรอยู่ไซยะบุรี - สปป.ลาว,https://pantip.com/topic/38311535,60,20,2018-11-28T10:57:00.000000+0642
175,40782718,คนอายุเยอะๆในที่ทำงานมีปัญหากับเทคโนโลยีมากจนคิดว่าเค้าควรลาออก,https://pantip.com/topic/40782718,128,4,2021-06-17T11:53:00.000000+0642
176,40570254,เราตัดสินใจผิดมั้ย ที่จะลาออกจากงานประจำเงินเดือนรายรับ4หมื่น เพื่อเรียนรู้การเป็น barista แค่ได้ชงกาแฟอร่อยๆก็พอใจแล้ว,https://pantip.com/topic/40570254,121,1,2021-03-09T19:30:00.000000+0642
177,35128525,มีใครอดทนทำงานที่ได้รับเงินเดือนน้อยมาก เพื่อหวังโอกาสก้าวหน้าเหมือนกับเรามั้ย?,https://pantip.com/topic/35128525,121,0,2016-05-07T18:32:00.000000+0642
178,36660077,ทำงานบริษัทญี่ปุ่น ประสพการณ์ที่ไม่มีวันลืม,https://pantip.com/topic/36660077,144,114,2017-07-13T11:45:00.000000+0642
179,40394231,ทำไมผม มีความสุขมาก เพราะไม่มีลูก,https://pantip.com/topic/40394231,224,48,2020-12-19T00:07:00.000000+0642
180,40778434,คนที่ทำราชการบอกว่า เงินเดือนของพนักงานเอกชนหากอยู่ในตำแหน่งสูงๆ จะโดนบีบออกจริงหรอคะ,https://pantip.com/topic/40778434,123,1,2021-06-15T13:04:00.000000+0642
181,40774238,พี่ที่ทำงานต้องการลางาน 2-3 เดือน (leave without pay) จะพูดยังไงดีว่าอาจจะต้องเลิกจ้าง,https://pantip.com/topic/40774238,76,6,2021-06-13T14:50:00.000000+0642
182,40500814,อยากถามคนโสดมนุษย์เงินเดือนและธุรกิจส่วนตัวที่ อายุ40+ ตอนนี้คุณมีเงินเก็บเท่าไหร่ และพอใจกับสถาณะตัวเองไหม?,https://pantip.com/topic/40500814,93,5,2021-02-05T21:14:00.000000+0642
183,40771977,คนที่บอกว่ามนุษย์เงินเดือนดีกว่าเจ้าของกิจการเยอะ ไม่เสี่ยง มีบริษัทคุ้มหัว มีสังคมนี่องุ่นเปรี้ยวรึปล่าว,https://pantip.com/topic/40771977,93,5,2021-06-12T12:49:00.000000+0642
184,38554272,มีใครเป็นบ้างครับ พออายุมากขึ้นแล้วรู้สึกว่าร่างกายไม่อึดในการทำงานเหมือนเดิม,https://pantip.com/topic/38554272,68,12,2019-02-14T07:12:00.000000+0642
185,40779843,เราอายุ 23 ต้องเลี้ยงพี่สาวที่เรียนจบมาหลายปีที่อายุเกิน 25 ใกล้จะ 30 แต่หางานทำไม่ได้ 🥺😢,https://pantip.com/topic/40779843,60,2,2021-06-16T00:43:00.000000+0642
186,40618798,อะไรทำให้มนุษย์เงินเดือนอย่างพวกคุณตัดสินใจที่จะไม่ซื้อบ้านที่พักหรือคอนโดอยู่อาศัยกันครับ..,https://pantip.com/topic/40618798,68,1,2021-04-02T14:03:00.000000+0642
187,30487048,ทำไมคนอยากเป็นข้าราชการกันครับ ทั้งที่เงินน้อยกว่าทำธุรกิจเอง,https://pantip.com/topic/30487048,74,0,2013-05-14T21:42:00.000000+0642
188,40776088,อยากถามคนที่ทำงาน 6 วันต่อสัปดาห์ว่ารู้สึกยังไงกันบ้าง แล้วบริหารจัดการเวลาชีวิตกันอย่างไร,https://pantip.com/topic/40776088,76,0,2021-06-14T12:13:00.000000+0642
189,40708294,อายุ 23 พึ่งได้ออกจากบ้านมาลองใช้ชีวิตเองครั้งแรกครับ รู้สึกเครียดครับ,https://pantip.com/topic/40708294,120,5,2021-05-14T16:08:00.000000+0642
