,post_id,title,url,comment_count,vote_count,published_date
383,40351969,พนง.ออฟฟิศ นาฬิกาแพงสุดที่ซื้อมาใส่ ยี่ห้ออะไร ราคาเท่าไหร่ครับ,https://pantip.com/topic/40351969,134,0,2020-11-28T14:54:00.000000+0642
384,30444290,"= จากเงินเดือน 10,000 เป็น 100,000 = [ตอนที่ 1]",https://pantip.com/topic/30444290,176,218,2013-05-04T12:46:00.000000+0642
385,35203626,เรื่องราวที่วัยรุ่นยุคนี้อาจไม่เข้าใจว่าวัยรุ่นยุคก่อนลำบากยังไง,https://pantip.com/topic/35203626,101,105,2016-05-26T23:39:00.000000+0642
386,37235188,มาถึงวันนี้ถึงได้รู้ว่า เราคือคนชั้นกลาง ที่ตกรถไฟมาถึงสามรุ่นแล้ว,https://pantip.com/topic/37235188,104,94,2017-12-31T13:18:00.000000+0642
387,40332137,"คนที่รับเงินเดือนสูง ๆ 50,000 ขึ้นกดดันในอาชีพไหม",https://pantip.com/topic/40332137,65,0,2020-11-19T15:00:00.000000+0642
388,40206700,มีใครไม่มีสังคม ไม่มีเพื่อน ไม่มีแฟน มีความสุขไหม,https://pantip.com/topic/40206700,97,3,2020-09-19T00:11:00.000000+0642
389,40322871,"ผิดไหมกับการพูดไปตรงๆว่า ""มันไม่ใช่หน้าที่""",https://pantip.com/topic/40322871,102,0,2020-11-15T11:36:00.000000+0642
390,33420813,เคยมีประสบการณ์ ที่หน้าแตก กันบ้างไหมครับ มาฟังเรื่องสั้นของผมซักหน่อยไหม (อายๆๆ),https://pantip.com/topic/33420813,286,47,2015-03-25T15:33:00.000000+0642
391,40330742,มีมครเคยลาออก เพราะเพื่อนร่วมงานวร้ายๆมั้ยคะ,https://pantip.com/topic/40330742,55,2,2020-11-18T21:20:00.000000+0642
392,40331706,"เพื่อนๆคิดยังไงกับวลีนี้คะ ""ใครมีงานทำตอนนี้ ให้กอดงานประจำไว้แน่นๆ""",https://pantip.com/topic/40331706,81,0,2020-11-19T11:23:00.000000+0642
393,40327116,ทำยังไงให้เราสามารถนอน 6 ชั่วโมง แต่รู้สึกเหมือนนอนเต็มอิ่ม 10 ชั่วโมง โดยไม่ง่วงในตอนบ่ายได้บ้างครับ,https://pantip.com/topic/40327116,52,1,2020-11-17T10:33:00.000000+0642
394,36848688,Review : ขั้นตอนการสอบเข้า AOT ปี 2560 แบบคนไม่มีเส้น,https://pantip.com/topic/36848688,68,36,2017-09-07T12:00:00.000000+0642
395,40318071,รู้สึกว่าตัวเองทำงานไม่คุ้มเงินเดือนครับ,https://pantip.com/topic/40318071,77,1,2020-11-12T21:05:00.000000+0642
396,40317851,คนที่ไม่เคยถูกล็อตเตอรี่ อะไรทำให้คุณยังมีความหวังที่จะถูกรางวัลอยู่คะ,https://pantip.com/topic/40317851,83,7,2020-11-12T19:11:00.000000+0642
397,34236620,งานที่ให้เงินเยอะกว่า กับ งานที่ชอบ จะเลือกแบบไหนกันครับ,https://pantip.com/topic/34236620,77,0,2015-09-28T03:57:00.000000+0642
398,40290600,ถ้าลาออกจากงานตอนนี้ ควรมีเงินสำรองกี่เดือนถึงจะรอด,https://pantip.com/topic/40290600,64,0,2020-10-30T15:25:00.000000+0642
399,40303567,โดนไล่ออกเพราะว่าช่วยเลือกสินค้าให้ลูกค้า,https://pantip.com/topic/40303567,95,39,2020-11-05T22:30:00.000000+0642
400,39222559,สมัยก่อนเข้าว่าทำงานธนาคารนี้โก้นัก อยากทราบว่าโก้จริงมั้ยครับ หรือเป็นภาพลักษณ์ที่คนไม่รู้คิดกันไปเอง,https://pantip.com/topic/39222559,76,0,2019-09-12T00:07:00.000000+0642
401,31923775,เมื่อวิศวกรมนุษย์เงินเดือน เดินออกมาเป็นพ่อค้ามนุษย์เงินวัน ...... [เปิดทุกมุมของชีวิตที่อยากรวย],https://pantip.com/topic/31923775,1900,788,2014-04-17T11:48:00.000000+0642
402,40297913,สอบถามคนที่มีเงินเดือน 25k และกำลังผ่อนคอนโด 2mb.,https://pantip.com/topic/40297913,61,0,2020-11-03T10:58:00.000000+0642
403,36156274,ถามคนที่เคยลาออกมาพักเฉยๆ มันดีจิงมั้ย,https://pantip.com/topic/36156274,75,1,2017-02-27T07:18:00.000000+0642
404,36002920,กำลังจะลาออกจากงานแล้ว เริ่มต้นออก เที่ยวเก็บประสบการณ์,https://pantip.com/topic/36002920,113,3,2017-01-12T12:30:00.000000+0642
405,32910547,"แบ่งปันประสบการณ์ ""สอบบรรจุครูผู้ช่วยได้"" โดยใช้เวลาเตรียมตัว 1 เดือน",https://pantip.com/topic/32910547,67,73,2014-11-27T14:38:00.000000+0642
406,40285130,ยังหางานไม่ได้เลยค่ะ เครียด เหงา อายุ40 โปรไฟล์บ้านๆมันแย่มากเหรอ 😅,https://pantip.com/topic/40285130,67,5,2020-10-27T21:54:00.000000+0642
407,31105083,เรื่องราวชีวิตของผู้แทนยา ที่ใครๆว่าเหมือนหมาล่าเนื้อ,https://pantip.com/topic/31105083,133,55,2013-10-13T20:13:00.000000+0642
408,40280874,ไม่ได้รับซองงานแต่งของคนที่ทำงาน รู้สึกยังไงกันครับ,https://pantip.com/topic/40280874,141,2,2020-10-25T22:21:00.000000+0642
409,35301952,ถ้าย้อนเวลาไปได้ คุณจะเที่ยวให้หมดทุกที่ หรือจะเก็บเงินออมไว้ให้มากที่สุดครับ,https://pantip.com/topic/35301952,98,3,2016-06-22T20:36:00.000000+0642
410,40280817,เพิ่งเรียนจบทำงาน เบื่อชีวิตวัยทำงาน,https://pantip.com/topic/40280817,85,0,2020-10-25T21:58:00.000000+0642
411,34722548,"อายุ 30 แล้ว เงินเดือนแค่ 30,000 บาท ชีวิตดูไร้อนาคตไหมครับ",https://pantip.com/topic/34722548,175,1,2016-01-26T23:06:00.000000+0642
412,40267673,เราจำเป็นต้องมี Facebook เพื่อนร่วมงานไหมครับ?,https://pantip.com/topic/40267673,54,0,2020-10-19T09:30:00.000000+0642
413,40273386,ผมพึ่งมาสังเกตว่าคนที่บอกว่าเงินซื้อความสุขไม่ได้ ส่วนใหญ่หน้าที่การงานดีๆรวยๆทั้งนั้น,https://pantip.com/topic/40273386,175,10,2020-10-22T01:06:00.000000+0642
414,36670205,อย่ามาเป็นProgramerกินเงินเดือน หากไม่ได้หลงรักการเขียนโปรแกรม(เตือนใจน้องๆ),https://pantip.com/topic/36670205,119,71,2017-07-16T12:55:00.000000+0642
415,40256317,คิดหนัก !!! จะประเมินให้ พนักงานที่เข้ามาใหม่ไม่ผ่านโปร,https://pantip.com/topic/40256317,145,7,2020-10-13T11:00:00.000000+0642
416,40214354,ตกงานเพราะโควิค...วันนี้ต้องมาเป็น Fulltime Trader จริงๆ แล้ว ขอกำลังใจด้วยครับ...,https://pantip.com/topic/40214354,99,26,2020-09-22T17:28:00.000000+0642
417,36530417,ลาออกจากครูผู้ช่วย,https://pantip.com/topic/36530417,109,5,2017-06-04T15:59:00.000000+0642
418,40247005,“งานราชการ เวลาเยอะเงินน้อย” กับ “งานเอกชน เวลาน้อยเงินเยอะ” เลือกอะไรดีครับ???,https://pantip.com/topic/40247005,77,0,2020-10-08T13:32:00.000000+0642
419,35439860,แชร์ประสบการณ์ จากเริ่มต้นจนถึง 100ล้านบาท,https://pantip.com/topic/35439860,90,93,2016-07-30T23:42:00.000000+0642
420,38856449,มีเงิน 1ล้านบาทแรกกันตอนไหนคะ,https://pantip.com/topic/38856449,76,0,2019-05-11T16:48:00.000000+0642
421,40224624,ภาวะเศรษฐกิจที่ปรากฏตามข่าว ที่เห็นประจำคือเลิกกิจการ เลิกจ้าง ตกงาน โดนลดเงินเดือน แต่พอไปดูแต่ละคน..มันใช่หรือ,https://pantip.com/topic/40224624,111,9,2020-09-27T16:32:00.000000+0642
422,40218484,อายุเยอะตกงานบริหารเงินก้อนสุดท้ายอย่างไรดี,https://pantip.com/topic/40218484,62,6,2020-09-24T15:28:00.000000+0642
423,33729347,ก้าวแรกสู่การมีเงินล้าน (ขอบคุณอาจารย์ทุกท่านที่เคยสอนมาครับ),https://pantip.com/topic/33729347,145,503,2015-05-31T23:50:00.000000+0642
424,38634587,แชร์ประสบการณ์การเป็นครูเอกชน ที่ไม่ได้สวยงาม อย่างที่ใจคิด,https://pantip.com/topic/38634587,54,27,2019-03-08T22:15:00.000000+0642
425,35808290,ถ้าที่ทำงานให้นั่งเฉยๆโดยไม่ให้งานคุณทำ แต่ยังจ่ายเงินเดือนให้ จะลาออกไหมครับ?,https://pantip.com/topic/35808290,211,2,2016-11-14T17:50:00.000000+0642
426,40195285,เครียดครับ ตกงานมาจะ 6 เดือนละ,https://pantip.com/topic/40195285,95,16,2020-09-13T20:23:00.000000+0642
427,40199349,ขอถามตรงๆเลยนะคะ จะให้เด็กจบใหม่เอาอะไรไปสู้คนมีประสบการณ์??,https://pantip.com/topic/40199349,95,1,2020-09-15T16:37:00.000000+0642
428,30347780,ข้อคิดที่ได้จากการทำงานมาครบ 10 ปี,https://pantip.com/topic/30347780,145,376,2013-04-08T19:51:00.000000+0642
429,40189886,ในเมื่อเศรษฐกิจย่ำแย่ขนาดนี้ ต่อไปคนรุ่นหลังจะสร้างเนื้อสร้างตัวได้ยังไงครับ,https://pantip.com/topic/40189886,120,17,2020-09-11T10:57:00.000000+0642
430,39059596,สาเหตุที่คุณไม่ขึ้น MRT BTS คืออะไร,https://pantip.com/topic/39059596,158,5,2019-07-16T16:22:00.000000+0642
431,33106623,วิศวะเงินเดือนเป็นแสน นี้เขาทำกันยังไงหรอครับ?,https://pantip.com/topic/33106623,128,4,2015-01-15T11:06:00.000000+0642
432,40189623,"ได้ยินผู้บริหารคุยกัน ประมาณว่า ""องค์กรเรามีผู้หญิงเยอะเกินไปแล้ว ลาคลอดที 4-5คน แล้วใครจะทำงาน""",https://pantip.com/topic/40189623,104,1,2020-09-11T08:56:00.000000+0642
433,31533542,"ระหว่าง ""คนเมือง"" กับ ""คนชนบท"" คุณคิดว่าแบบไหนมีความสุขมากกว่ากันค่ะ",https://pantip.com/topic/31533542,151,7,2014-01-18T14:14:00.000000+0642
434,40180745,ใครเคยถูกกลั่นเเกล้งในที่ทำงาน หรือต้องอยู่ร่วมกับเพื่อนร่วมงานเเย่ๆ บ้างคะ?,https://pantip.com/topic/40180745,56,0,2020-09-07T10:21:00.000000+0642
435,40183734,การที่พ่อแม่บังคับไม่ให้ลูกสมัครเรียนในคณะที่มีความเสี่ยงว่าจบแล้วจะตกงาน กลายเป็นเรื่องที่ถูกต้องไปแล้วหรือเปล่าครับ,https://pantip.com/topic/40183734,101,1,2020-09-08T16:20:00.000000+0642
436,31469281,[CR] The Secret Life of Walter Mitty : ชีวิตอัศจรรย์ ความฝัน ความจริง,https://pantip.com/topic/31469281,78,396,2014-01-04T16:07:00.000000+0642
437,31861416,มาบรรจุข้าราชการวันแรก แทบอยากลาออก,https://pantip.com/topic/31861416,65,21,2014-04-01T22:48:00.000000+0642
438,32558105,เหตุผลที่ทำไมคุณถึงต้องก้าวออกมาจาก COMFORT ZONE,https://pantip.com/topic/32558105,108,298,2014-09-09T13:25:00.000000+0642
439,38103852,เงินเดือนหมื่นห้าใช้ชีวิตยังไงกลางกรุงเทพแบบแฮปปี้ตามฉบับของเราจ้า,https://pantip.com/topic/38103852,94,165,2018-09-28T17:47:00.000000+0642
440,40166964,สมัยนี้การเป็นคนไม่สวย รูปร่างไม่ดีก็เหนื่อยหน่อยใช่ไหมคะ?,https://pantip.com/topic/40166964,86,0,2020-08-31T18:10:00.000000+0642
441,39994576,เวลาเหนื่อยๆตัวคนเดียว หาวิธีแก้ยังไง,https://pantip.com/topic/39994576,81,0,2020-06-18T21:10:00.000000+0642
442,32320819,กำลังจะตกงานเร็วๆ นี้ อยากขอฟังประสบการณ์ดีๆ เมื่อตัดสินใจลาออกบ้าง เพราะตอนนี้เครียดมาก อยากมองแง่บวกบ้างค่ะ,https://pantip.com/topic/32320819,152,35,2014-07-14T09:32:00.000000+0642
443,40163434,ถ้าได้ทำงานที่ชอบ จะมีความสุขกับการตื่นเช้าไปทำงานไหมคะ,https://pantip.com/topic/40163434,79,0,2020-08-30T03:23:00.000000+0642
444,30106389,ธนาคารเลือกคนให้บริการดูที่การแต่งตัวหรือ,https://pantip.com/topic/30106389,83,37,2013-02-02T08:35:00.000000+0642
445,40151217,มีใครเหนื่อยกับงานจนอยากลาออกมั้ยคะ ดึงสติกันยังไงบ้างคะ ตอนนี้,https://pantip.com/topic/40151217,72,0,2020-08-24T16:11:00.000000+0642
446,32486663,กับดักมนุษย์เงินเดือน จากใจฟรีแลนซ์,https://pantip.com/topic/32486663,369,1400,2014-08-22T21:38:00.000000+0642
447,40153114,พี่ๆที่ทำงานแล้ว คิดว่า Skill อะไรสำคัญที่สุดในโลกของการทำงานครับ?!,https://pantip.com/topic/40153114,136,0,2020-08-25T13:13:00.000000+0642
448,40152918,เพื่อนร่วมงานเข้างาน11.00น,https://pantip.com/topic/40152918,97,0,2020-08-25T11:29:00.000000+0642
449,30912404,"เคาะแล้ว!! เบี้ยชีพตลอดชีพ ส.ส.-ส.ว. รับเนาะๆ 15,000 บาทต่อเดือน -ล่าสุดลงชื่อแล้ว 3 พันคน",https://pantip.com/topic/30912404,82,7,2013-08-30T13:48:00.000000+0642
450,37914224,คุณคิดว่า รายได้ต่ำถึงปานกลาง แต่มีรสนิมดีเข้าสังคมเก่ง กับ รายได้ดีแต่รสนิยมไม่มี เข้าสังคมไม่เป็น แบบไหนดีกว่า,https://pantip.com/topic/37914224,97,0,2018-07-31T09:49:00.000000+0642
451,40134633,ตำแหน่งงาน และเงินเดือนตอนคุณจบใหม่ (22-23ปี) เท่าไหร่ มาแชร์กัน,https://pantip.com/topic/40134633,259,0,2020-08-17T00:30:00.000000+0642
452,31742874,หลุด! … โพย 35 คำถามยอดฮิตยามสัมภาษณ์งาน,https://pantip.com/topic/31742874,59,77,2014-03-06T07:08:00.000000+0642
453,40140615,introvert เปลี่ยนเป็น extrovert ได้ไหมคะ?,https://pantip.com/topic/40140615,55,0,2020-08-19T18:17:00.000000+0642
454,40088042,หางานไม่ได้มา 3 เดือนแล้ว โรคซึมเศร้ากำลังกลับมา,https://pantip.com/topic/40088042,79,3,2020-07-27T01:58:00.000000+0642
455,40142423,คนที่ทำงานมานานๆเงินเดือนเยอะๆ จะโดนบีบให้ออก จริงหรือป่าวคะ??,https://pantip.com/topic/40142423,80,1,2020-08-20T15:06:00.000000+0642
456,37064028,เมื่อผมฟ้องอดีตนายจ้าง กรณีเลิกจ้างไม่เป็นธรรม อุทาหรณ์และการปฎิบัติตัวสำหรับมนุษย์เงินเดือน,https://pantip.com/topic/37064028,76,49,2017-11-07T17:05:00.000000+0642
457,30552816,คุณคิดว่าการที่ผู้ชายจะดีได้ภรรยามีส่วนไหมในการสร้องเนื้อสร้างตัวของสามี,https://pantip.com/topic/30552816,64,9,2013-05-31T18:17:00.000000+0642
458,40122859,"สำนวนของเติ้ง เสี่ยว ผิง ""แมวจะสีอะไรไม่สำคัญ ขอให้จับหนูได้ก็พอ""",https://pantip.com/topic/40122859,51,0,2020-08-11T16:23:00.000000+0642
459,38905919,"อย่าหลงเชื่อคำขายฝันด้วยคำว่า ""เรียน นักบิน""",https://pantip.com/topic/38905919,60,178,2019-05-26T19:44:00.000000+0642
460,40117036,ปฏิเสธเพื่อนร่วมงานที่ชอบขอติดรถกลับบ้านด้วยยังไงดีคะ,https://pantip.com/topic/40117036,150,3,2020-08-09T00:50:00.000000+0642
461,40119935,ได้งานที่แรก ทำได้วันครึ่ง ลาออก ผิดไหมคะ?,https://pantip.com/topic/40119935,163,1,2020-08-10T12:05:00.000000+0642
462,40002267,มีเงินสด 3 ล้าน มีธุรกิจอะไรน่าสนใจบ้างครับ,https://pantip.com/topic/40002267,62,0,2020-06-21T21:53:00.000000+0642
463,40107800,ทำไมผมถึงรู้สึกว่าเดี๋ยวนี้ความรัก มันเป็นเงินเป็นทองไปหมดครับ หรือผมคิดไปคนเดียว,https://pantip.com/topic/40107800,130,14,2020-08-04T20:17:00.000000+0642
464,39986379,สัมภาษณ์งานแล้วทางบริษัทขอดู Facebook เรา คิดว่ามันเกินไปมั้ย,https://pantip.com/topic/39986379,148,1,2020-06-15T20:23:00.000000+0642
465,40110172,ถ้าโควิดลากยาวไปอีก 2-3 ปี ทุกท่านคิดว่าสถานการณ์ของตัวเองจะเป็นยังไง,https://pantip.com/topic/40110172,99,0,2020-08-05T21:42:00.000000+0642
466,36022400,ทำงานที่ กทม. เงินไม่เหลือเก็บจริงหรอ,https://pantip.com/topic/36022400,71,1,2017-01-18T10:46:00.000000+0642
467,40099503,ทำไมบางคนไม่ทะเยอทะยาน,https://pantip.com/topic/40099503,81,0,2020-07-31T23:06:00.000000+0642
468,35124487,"มีใครอายุ30ปีและได้เงินเดือน 9,000 บาท ทั้งที่จบป.ตรีไหมคะ?",https://pantip.com/topic/35124487,395,12,2016-05-06T16:33:00.000000+0642
469,31967273,ประสบการณ์ เรื่องเล่าของตุ๊ดมนุษย์เงินเดือน ไปเป็นทหารเกณฑ์ ภาค 3 part 2,https://pantip.com/topic/31967273,2000,369,2014-04-26T14:08:00.000000+0642
470,35734944,พ่อแม่ขอเงินจนเงินแทบไม่เหลือเก็บ ทำไงดี,https://pantip.com/topic/35734944,138,41,2016-10-25T16:11:00.000000+0642
471,38725318,"เห็นรายได้ Youtuber, รู้สึกสิ่งหรืองานที่เราทำอยู่ มันเหมือน joke",https://pantip.com/topic/38725318,169,24,2019-04-03T01:49:00.000000+0642
472,39918217,เหตุเกิดจาก WFH ทำให้ความคิดที่อยากลาออกชัดเจนกว่าเดิม,https://pantip.com/topic/39918217,77,1,2020-05-22T01:39:00.000000+0642
473,40090451,>>> เริ่มเหนื่อยกับความเป๊ะของตัวเอง <<<,https://pantip.com/topic/40090451,81,10,2020-07-28T07:12:00.000000+0642
474,38729587,มนุษย์เงินเดือนหลังจากเกษียณ คิดว่าจะมีชีวิตอยู่อย่างมีความสุขได้อีกกี่ปี,https://pantip.com/topic/38729587,52,3,2019-04-04T10:18:00.000000+0642
475,40085731,สังคมคนวัยทำงาน ระหว่าง คนที่จบปริญญาตรี กับ คนที่ไม่ได้เรียนจบปริญญาตรี คุณคิดว่ามันต่างกันอย่างไรเหรอครับ,https://pantip.com/topic/40085731,114,0,2020-07-26T01:08:00.000000+0642
476,30346793,เห็นหลายกระทู้เงินเดือน 40000-80000 ทำงานอะไรกันคะ,https://pantip.com/topic/30346793,404,106,2013-04-08T14:42:00.000000+0642
477,40084237,ขอเหตุผลของคนที่อยู่ใน กทม แล้วลำบากแต่ก็ยังทนอยู่หน่อยครับ???,https://pantip.com/topic/40084237,77,3,2020-07-25T11:58:00.000000+0642
478,40081550,ปัญหาของเพื่อนร่วมงาน ที่ชอบแพ้กลิ่น จริงๆแล้วใครควรเป็นคนจัดการคะ,https://pantip.com/topic/40081550,127,0,2020-07-24T08:54:00.000000+0642
479,40075180,ทำไมวัยรุ่นสมัยนี้ถึงไม่ค่อยวางแผนการเงิน การงานกันเลยคะ,https://pantip.com/topic/40075180,107,0,2020-07-21T16:21:00.000000+0642
480,39716388,ต้องนอนวันละกี่ชม.คะ ถึงจะไม่ไปง่วงที่ทำงาน ?,https://pantip.com/topic/39716388,77,1,2020-03-15T12:19:00.000000+0642
481,38488604,คุณผู้ชายที่มีแฟนเงินเดือนมากกว่า รู้สึกนอยด์กันมั๊ยครับ,https://pantip.com/topic/38488604,102,1,2019-01-24T09:35:00.000000+0642
482,37508061,"ขอเคล็ดลับ คำว่า""อยู่เป็น"" ของสังคมทำงานยุคนี้หน่อยค่ะ",https://pantip.com/topic/37508061,58,1,2018-03-28T11:07:00.000000+0642
483,40067152,คนไทยมีเงินติดบัญชีกันไม่ถึง 5 หมื่นกว่า 90% จริงหรอครับ,https://pantip.com/topic/40067152,126,1,2020-07-18T09:47:00.000000+0642
