,post_id,title,url,comment_count,vote_count,published_date
190,37014775,ถ้าทุกคน..ย้อนเวลากลับไปได้ จะเลือกเรียนอะไร แล้วทำอาชีพอะไรครับ ?,https://pantip.com/topic/37014775,103,4,2017-10-24T00:06:00.000000+0642
191,40774076,ขอถามคนต่างจังหวัดที่เข้ามาใช้ชีวิตในกรุงเทพฯว่าเบื่ิอกรุงเทพมั้ยครับ แล้วมีเเผนจะกลับไปบ้านเกิดระยะยาวมั้ย,https://pantip.com/topic/40774076,84,2,2021-06-13T13:10:00.000000+0642
192,40767111,"""ดีได้แต่อย่าเด่น"" มันทำกันยังไงเหรอคะ",https://pantip.com/topic/40767111,61,0,2021-06-10T08:57:00.000000+0642
193,40758585,ทำงานมาเกือบ4ปีแล้วเงินเดือนมาแค่นี้ถือว่าน้อยไหมคะ,https://pantip.com/topic/40758585,85,1,2021-06-06T13:05:00.000000+0642
194,40745929,จะทำยังไงกับเพื่อนร่วมงานชอบลาหยุดทับกับวันหยุดประจำสัปดาห์ของผม,https://pantip.com/topic/40745929,62,0,2021-05-31T16:42:00.000000+0642
195,39037707,เครียดมาก เงินติดลบทุกเดือน รายรับไม่พอรายจ่าย,https://pantip.com/topic/39037707,233,3,2019-07-08T22:26:00.000000+0642
196,39482103,มีใครอายุเกิน 30 และรู้สึกว่าตัวเองเลือกเส้นทางชีวิตผิดพลาดบ้าง,https://pantip.com/topic/39482103,116,5,2019-12-12T19:25:00.000000+0642
197,40347469,สัญญาณอะไรบ้างที่ทำให้คุณตัดสินใจลาออกจากงาน,https://pantip.com/topic/40347469,71,0,2020-11-26T13:20:00.000000+0642
198,39931754,มนุษย์เงินเดือน คิดว่าคุ้มกันไหมครับที่จะนำเอาเงินส่วนใหญ่ของเเงินเดือนรา มาลงทุนทุ่มทุนสร้างให้กับลูกในเรื่องการศึกษา,https://pantip.com/topic/39931754,89,0,2020-05-26T22:49:00.000000+0642
199,33894745,5 อาชีพฟรีแลนซ์ ปั้นเงินแสน! โดยไม่ต้องลาออกจากงานประจำ,https://pantip.com/topic/33894745,161,214,2015-07-09T07:23:00.000000+0642
200,40742944,เงินเดือนน้อย เเฟนบอกว่าไร้อนาคต เขาจากผมไปเเล้ว?,https://pantip.com/topic/40742944,76,4,2021-05-30T09:04:00.000000+0642
201,39034953,ถามจริงๆ คนเล่นหุ้นทุกวันนี้ สามารถดำรงชีพด้วยการเล่นหุ้นอย่างเดียวเหรอ,https://pantip.com/topic/39034953,83,0,2019-07-08T00:57:00.000000+0642
202,32480613,มีเงิน 10 บาท ซื้ออะไรได้บ้าง? ... มาดูกันครับ กับร้านทุกอย่าง 10 บาท!!!!,https://pantip.com/topic/32480613,91,169,2014-08-21T13:47:00.000000+0642
203,38369500,ตั้งแต่เปลี่ยนนิสัยเป็นคนขี้โวยวายนี่รู้สึกว่าชีวิตดีขึ้นเยอะเลย ใครเคยลองเหมือนกันบ้างครับ,https://pantip.com/topic/38369500,142,50,2018-12-16T14:52:00.000000+0642
204,40743462,น้องที่ทำงานมาบอกว่าจะลาออกจากงานเพราะงานไม่สนุกและไม่ท้าทาย,https://pantip.com/topic/40743462,88,0,2021-05-30T14:25:00.000000+0642
205,32792239,"14 ปีที่แล้ว จากเด็กขับรถส่งของ เงินเดือน 3,600 บาท สู่ธุรกิจขายอะไหล่รถยนต์มือสองออนไลน์ รายได้เฉลี่ย 6 หลักต่อเดือน",https://pantip.com/topic/32792239,53,56,2014-10-31T19:26:00.000000+0642
206,36538764,เล่าประสบการณ์การเรียน MBA ที่ Oxford,https://pantip.com/topic/36538764,53,60,2017-06-06T21:41:00.000000+0642
207,40731685,เพื่อนๆ เผื่อเงินสดฉุกเฉินไว้เท่าไหร่ครับ ??,https://pantip.com/topic/40731685,79,4,2021-05-25T06:04:00.000000+0642
208,36057197,Programmer จากเงินเดือน 18k สู่ 55k ใน 6 ปี,https://pantip.com/topic/36057197,68,30,2017-01-28T21:59:00.000000+0642
209,39596019,อยากได้คำแนะนำหรือมุมมองจากพี่ๆอายุ30-40 ว่าอะไรคือสิ่งที่ต้องระวัง สิ่งที่ต้องรีบทำ รีบเก็บเกี่ยวในช่วง22-30 ?,https://pantip.com/topic/39596019,139,7,2020-01-27T23:22:00.000000+0642
210,40738302,เราอยากเลิกกับแฟนมาก แต่เค้าไม่ได้ทำผิดอะไรร้ายแรงเลย เราไม่รู้จะพูดกับเค้ายังไงดี,https://pantip.com/topic/40738302,115,2,2021-05-27T23:29:00.000000+0642
211,40419499,ทำไมคนต่างจังหวัดบางคนที่เข้ามาทำงานในกรุงเทพถึงยอมทิ้งเงินเดือนหลักหลายหมื่นเพื่อกลับบ้านก่อนเกษียณครับ,https://pantip.com/topic/40419499,60,0,2020-12-31T14:07:00.000000+0642
212,39996050,เงินเดือน 40k ออก BMW รุ่นไหนได้บ้าง,https://pantip.com/topic/39996050,181,0,2020-06-19T12:23:00.000000+0642
213,40729932,Work From Home (WFH) ที่ไม่ใช่บ้านตัวเองนี่ผิดมากขนาดไหน,https://pantip.com/topic/40729932,135,1,2021-05-24T12:21:00.000000+0642
214,40732073,การที่เราไม่ได้เดือดร้อนเรื่องเงิน ทำให้ที่ทำงานมีสิทธิ์ไม่ปรับเงินเดือนขึ้นให้หรอคะ,https://pantip.com/topic/40732073,84,4,2021-05-25T11:07:00.000000+0642
215,40730224,คนเรียนเก่งบางคน ทำไมไม่ประสบความสำเร็จ,https://pantip.com/topic/40730224,70,1,2021-05-24T14:45:00.000000+0642
216,40730320,วัยทำงาน หนุ่มสาวทำงานออฟฟิศ หาแฟนได้ที่ไหนกันคะ?,https://pantip.com/topic/40730320,80,0,2021-05-24T15:29:00.000000+0642
217,36286979,*** ถ้าผู้ชายรวยเมื่อไร จะสามารถจีบผู้หญิงสวยตามที่ต้องการได้จริงๆใช่ไหมคับ ***,https://pantip.com/topic/36286979,124,0,2017-03-31T20:47:00.000000+0642
218,40720319,อยากฝากถึงหัวหน้าที่คิดว่าลูกน้องทำงานเกินเวลาเป็นคนขยัน,https://pantip.com/topic/40720319,104,46,2021-05-19T23:08:00.000000+0642
219,39946713,จริงๆแล้ว เรามีลูกไว้ทำไมเหรอครับ?,https://pantip.com/topic/39946713,132,0,2020-06-01T10:30:00.000000+0642
220,40717631,ความอยากได้อยากมี เอาปมในวัยเด็กมาเป็นข้ออ้าง สร้างหนี้บัตรเครดิตจนท้วมหัว หาทางแก้ไม่ได้ พอจะมีคำแนะนำบ้างไหมคะ,https://pantip.com/topic/40717631,76,4,2021-05-18T20:30:00.000000+0642
221,40721195,มีใครไม่กล้าบอกเงินเดือนจริงๆให้เพื่อนรู้ไหมเพราะกล้วโดนยืม,https://pantip.com/topic/40721195,127,1,2021-05-20T12:08:00.000000+0642
222,40715638,คนตกงาน ช่วงนี้ชีวิตเป็นยังไงครับ,https://pantip.com/topic/40715638,119,1,2021-05-17T23:09:00.000000+0642
223,40667937,WFH แต่บริษัทละเมิดความเป็นส่วนตัว บังคับต้องเช็คอินแอพทุก 90 นาทีเลยค่ะ 😰😰,https://pantip.com/topic/40667937,421,5,2021-04-26T16:59:00.000000+0642
224,40458337,มีเงินเก็บแล้วเครียด (อยากได้คำแนะนำ),https://pantip.com/topic/40458337,100,1,2021-01-18T18:08:00.000000+0642
225,31964720,ขอถาม ค่ะ ผู้ชายคิดยังไง กับผู้หญิงที่ยอมนอนกับคุณ (คบกันเป็นแฟนแล้วนะคะ)แล้วสาวๆคิดยังไงกับเรื่องนี้บ้างคะ,https://pantip.com/topic/31964720,55,0,2014-04-25T21:13:00.000000+0642
226,38519325,งานออนไลน์ ได้เงินจริงไหม..??,https://pantip.com/topic/38519325,94,0,2019-02-03T00:38:00.000000+0642
227,31420619,เรียนทันตแพทย์ไม่จบ ทำอะไรต่อไปดีคะ,https://pantip.com/topic/31420619,167,91,2013-12-22T23:00:00.000000+0642
228,40705295,ถามมนุษย์เงินเดือนทุกท่าน ทำอะไรเวลาไม่มีงานครับ,https://pantip.com/topic/40705295,72,1,2021-05-13T11:00:00.000000+0642
229,40702489,โดนที่ทำงานบังคับให้ฉีดวัคซีน,https://pantip.com/topic/40702489,120,4,2021-05-12T07:27:00.000000+0642
230,40300088,สมมติเงินเดือน 30kแต่มีอิมแพคต่อสังคม มีชื่อเราในหนังสือเรียน กับเงินเดือน 70k ทำงานขายของเฉยๆ คุณจะเลือกชีวิตแบบไหน,https://pantip.com/topic/40300088,83,2,2020-11-04T11:52:00.000000+0642
231,36074635,อยากถามคนที่ไม่สมัครกองทุนสำรองเลี้ยงชีพค่ะว่า เพราะอะไร (อย่าตอบว่าเรื่องของกรูนะคะ 555),https://pantip.com/topic/36074635,125,21,2017-02-03T08:52:00.000000+0642
232,40023812,"รู้สึกยังไงกับผู้หญิงที่ถูกเรียกว่า ""เจ๊""",https://pantip.com/topic/40023812,117,1,2020-06-30T06:45:00.000000+0642
233,33744233,แต่ละสาขาอาชีพ ... ทำงานเหน็ดเหนื่อยแค่ไหน? และ หาโอกาสพักผ่อน ชาร์จพลังชีวิต กันอย่างไรบ้าง?,https://pantip.com/topic/33744233,63,1,2015-06-04T12:27:00.000000+0642
234,30685541,อายุ 33 เงินเดือน 35000 น้อยไปมั้ย ?,https://pantip.com/topic/30685541,97,0,2013-07-05T11:09:00.000000+0642
235,40676916,อะไรคือเหตุผลของคนที่มีอิสรภาพทางการเงินแล้ว แต่ยังคงทำงานต่อไม่หยุดครับ,https://pantip.com/topic/40676916,83,17,2021-04-30T16:07:00.000000+0642
236,40689152,การ Work From Home ช่วยให้คุณมีเงินเดือนเหลือเก็บมากขึ้นไหมครับ,https://pantip.com/topic/40689152,111,0,2021-05-06T09:46:00.000000+0642
237,40679429,ท้อบ้างไหมครับ หาเงินมาแล้วไม่ได้ใช้เลย,https://pantip.com/topic/40679429,87,0,2021-05-01T20:06:00.000000+0642
238,39132550,อยากรู้ทำไมคนไทยถึงจนลง ตอนนี้ส่วนใหญ่คนไทยอย่างเราๆ มีรายได้จากงานด้านไหนกันมากที่สุดครับ เรียงลำดับหน่อยครับ,https://pantip.com/topic/39132550,65,1,2019-08-11T08:10:00.000000+0642
239,37942338,ออมให้เงินโต ตอนที่ 2.2 กองทุนรวมภาคจบ คัดเลือกกองทุน และ ลดความเสี่ยงจากการลงทุน,https://pantip.com/topic/37942338,64,99,2018-08-09T15:40:00.000000+0642
240,40679706,"โดนไล่ออกเพร่ะพูดคำว่า ""อ่าาค่ะ""",https://pantip.com/topic/40679706,104,0,2021-05-01T22:07:00.000000+0642
241,33485340,ระหว่างซื้อทองเก็บเดือนละ 1 บาท กับออมเงินฝากเดือนละสองหมื่น อันไหนเข้าท่ากว่ากันคะ (ไม่นับหุ้นนะคะ ไม่ถนัด),https://pantip.com/topic/33485340,76,0,2015-04-08T17:26:00.000000+0642
242,36021935,ถ้าต้องทำงานกับหัวหน้าที่โง่กว่าคุณ คุณจะ...???,https://pantip.com/topic/36021935,140,2,2017-01-18T05:24:00.000000+0642
243,40383253,มนุษย์เงินเดือน หาแฟนจากไหนได้บ้างคะ,https://pantip.com/topic/40383253,110,6,2020-12-13T22:00:00.000000+0642
244,39584752,"สัมภาษณ์งานคำถามคือ ""ทำไมถึงลาออกจากที่เก่า""",https://pantip.com/topic/39584752,51,4,2020-01-23T10:57:00.000000+0642
245,40671021,WFH กำลังจะทำให้เราเป็นบ้า !,https://pantip.com/topic/40671021,118,19,2021-04-28T00:07:00.000000+0642
246,40673303,ฐานเงินเดือน 30K + ฟรีแลนซ์ 10K โดนแฟนด่าว่าเป็นพนักงานเงินเดือนกระจอก,https://pantip.com/topic/40673303,99,5,2021-04-28T23:32:00.000000+0642
247,33856539,เบื่อที่ทำงาน ไม่ใช่เพราะงาน แต่เพราะคน! ใครเจอเหมือนกันบ้างมาแชร์กัน,https://pantip.com/topic/33856539,204,181,2015-06-30T13:13:00.000000+0642
248,38195418,ผมเคยค้านหัวชนฝามาตลอด เวลามีคนพูดว่าเด็ก ม.ดัง ทำงานดีกว่า เด็ก ม.ไม่ดัง จนกระทั่ง...,https://pantip.com/topic/38195418,126,44,2018-10-23T21:18:00.000000+0642
249,40395470,กำลังจะเป็นคนว่างงาน มีเงินเก็บ1.4ล้าน อยู่แบบประหยัดได้กี่เดือนคะ,https://pantip.com/topic/40395470,102,6,2020-12-19T18:07:00.000000+0642
250,40669643,Work From Home อย่างไรไม่ให้น้ำหนักขึ้นครับ,https://pantip.com/topic/40669643,52,0,2021-04-27T13:08:00.000000+0642
251,30806433,มนุษย์เงินเดือน อายุ 30-35 ปี คุณทำงานได้รับเงินเดือนเท่าไรกันบ้าง และตำแหน่งหน้าที่การงานที่รับผิดชอบ,https://pantip.com/topic/30806433,105,1,2013-08-05T22:04:00.000000+0642
252,40656672,สาเหตุอะไร ที่ทำให้เพื่อนๆตัดสินใจลาออกจากที่ทำงานบ้างคะ มาแชร์กันได้ค่ะ,https://pantip.com/topic/40656672,75,2,2021-04-21T16:05:00.000000+0642
253,31293040,4 เคล็ดลับที่ครอบครัวสอนผมเรื่อง “เงิน”,https://pantip.com/topic/31293040,96,638,2013-11-26T08:50:00.000000+0642
254,36353259,ครบ 1 ปี 3 เดือน ฉันไม่ได้บ้า แค่กล้าออกมาทำตามความฝัน กับชีวิตเกษตรพอเพียง,https://pantip.com/topic/36353259,88,96,2017-04-18T17:15:00.000000+0642
255,37168667,เมื่อฉันจบใหม่แต่ได้เงินเดือน 49k,https://pantip.com/topic/37168667,147,96,2017-12-09T01:15:00.000000+0642
256,40630848,ทำไมคนอื่นชอบหวังดีด้วยการอยากให้คนอื่นแต่งงานคะ,https://pantip.com/topic/40630848,70,8,2021-04-08T16:46:00.000000+0642
257,40643685,คิดยังไงกับผู้บริหารหรือหัวหน้าที่ใช้พนักงานเดินไปซื้ออาหารให้ตัวเองกินคะ,https://pantip.com/topic/40643685,99,2,2021-04-15T14:23:00.000000+0642
258,37181113,เล่าประสบการณ์ เซลบัตรเครดิต ละเอียดยิบ,https://pantip.com/topic/37181113,70,20,2017-12-12T23:06:00.000000+0642
259,40650173,สอบถามค่ะ มนุษย์เงินเดือน ใช้จ่ายต่อวันวันเท่าไหร่กันบ้างค่ะ,https://pantip.com/topic/40650173,97,0,2021-04-18T18:09:00.000000+0642
260,31596870,ช่วยดูหน่อยคะ กำไรจากขายก๋วยเตี๋ยว,https://pantip.com/topic/31596870,54,2,2014-02-01T14:50:00.000000+0642
261,40644485,การไม่เปลี่ยนงานเลยเป็นเรื่องแย่ไหมคะ ?,https://pantip.com/topic/40644485,74,0,2021-04-15T21:21:00.000000+0642
262,39740616,งานข้าราชการ สบายจริงหรอ? (ณ.ตอนนี้ คนตกงานหลายร้อยล้านคนทั่วโลก แต่ข้าราชการหยุดยาว รับ เงินเดือนเต็ม),https://pantip.com/topic/39740616,193,2,2020-03-24T11:27:00.000000+0642
263,40569314,งงว่าทำไมถึงได้มีมนุษย์เงินเดือนจำนวนมากถึงมองว่าการเก็บเงินล้านก่อน 30 เป็นเรื่องที่ยากครับ ผมว่ามันเป็นเรื่องปกติมากๆ,https://pantip.com/topic/40569314,253,8,2021-03-09T11:38:00.000000+0642
264,40359335,ถามมนุษย์เงินเดือนที่เงินเดือน40000อัพหน่อยครับ ทำตำแหน่งอะไรความรับผิดชอบอะไรบ้าง,https://pantip.com/topic/40359335,144,0,2020-12-01T22:05:00.000000+0642
265,38189440,จากใจ คนขับลาล่ามูฟ ไลน์แมน และแกร๊บ (บ่น+เล่าประสบการณ์),https://pantip.com/topic/38189440,55,75,2018-10-22T10:36:00.000000+0642
266,40638631,แฟนของผมนิสัยประมาณนี้(ฟุ่มเฟือย)ควรไปต่อไหมครับ,https://pantip.com/topic/40638631,102,0,2021-04-12T17:18:00.000000+0642
267,40117818,ตกงานตอนอายุ 40+,https://pantip.com/topic/40117818,73,95,2020-08-09T13:37:00.000000+0642
268,35547243,ขาดวิตามินบีก็มีโอกาสตายได้ .. แชร์ประสบการณ์จริงของผู้ชายที่วิ่งไล่ตามฝัน,https://pantip.com/topic/35547243,80,120,2016-08-31T18:35:00.000000+0642
269,40620818,มีใครไปถึงออฟฟิศไม่เกิน 7 โมงเช้าได้ และมีเคล็ดลับยังไงให้ไปถึงเช้าๆได้บ้าง นอนกี่โมงคะ,https://pantip.com/topic/40620818,81,0,2021-04-03T14:31:00.000000+0642
270,39879328,บริษัทเสนอตำแหน่งที่ต่ำลงมากๆให้แลกกับการมีงานทำต่อไป - ไปต่อหรือลาออก,https://pantip.com/topic/39879328,131,2,2020-05-08T20:39:00.000000+0642
271,40630145,ปี 2021 ตัวอำเภอเมืองต่างจังหวัดที่มีความเจริญ เพรียบพร้อมและรถไม่ติดมาก มีจังหวัดไหนบ้างคะ,https://pantip.com/topic/40630145,92,0,2021-04-08T10:12:00.000000+0642
272,40626666,ทำไมบริษัทถึงชอบมายุ่งวุ่นวายเกี่ยวกับ Facebook ส่วนตัวของพนักงานครับ,https://pantip.com/topic/40626666,78,1,2021-04-06T15:43:00.000000+0642
273,40611890,เคยตกงานไม่มีแม้แต่ตังออกไปทำงานไหมคะ,https://pantip.com/topic/40611890,88,5,2021-03-30T04:38:00.000000+0642
274,33442047,สงสัยจะไปไม่รอด ... คนนิสัยเงียบ ๆ ไม่ชอบเข้าสังคม แต่ ต้องมาทำงานที่ต้องเข้าสังคม,https://pantip.com/topic/33442047,104,55,2015-03-30T10:43:00.000000+0642
275,34409924,เเชร์ประสบการณ์ โลภ! หนี้ก้อนโต! บทเรียนราคาแสนเเพงในการลงทุนอสังหา,https://pantip.com/topic/34409924,74,122,2015-11-06T17:43:00.000000+0642
276,32674070,[กระทู้แชร์ประสบการณ์] เคยเมาแล้วก่อวีรกรรมไว้หนักขนาดไหน ??,https://pantip.com/topic/32674070,336,191,2014-10-06T10:18:00.000000+0642
277,40616998,เคยเจอคำพูดที่ว่า เด็กบางคนภูมิใจกันเหรอที่ใช้เงินพ่อแม่ พวกคุณมีความคิดเห็นอย่างไรกันมั้งคะ,https://pantip.com/topic/40616998,76,0,2021-04-01T16:09:00.000000+0642
278,30648528,รีโนเวทบ้านเบาๆกับบ้านหลังน้อยๆ เพื่อให้เช่า โดยซื้อมาจาก ธ.สีเหลืองครับ,https://pantip.com/topic/30648528,114,117,2013-06-25T16:17:00.000000+0642
279,40611644,คนที่ไม่มีลูก เวลาเห็นครอบครัวอื่นที่มีลูกรู้สึกนอยบ้างไหม,https://pantip.com/topic/40611644,93,0,2021-03-29T23:02:00.000000+0642
280,39889473,มีใครเคยเข้างานสายเพราะเหตุผลที่มันแปลกๆมั้ยครับ?,https://pantip.com/topic/39889473,138,1,2020-05-12T11:16:00.000000+0642
281,40607543,ชีวิตวัยเรียนกับตอนวัยทำงาน ความเหนื่อยมันต่างกันมากไหมคะ,https://pantip.com/topic/40607543,124,1,2021-03-27T21:40:00.000000+0642
282,32176555,ทนไม่ไหวแล้ว! กับการก่อสร้างอุโมงค์ลอดสี่แยกมไหสวรรค์!!!,https://pantip.com/topic/32176555,216,390,2014-06-11T11:45:00.000000+0642
283,34521625,ใครเคยทำงานผิดพลาดแบบร้ายแรงมากๆบ้างครับ,https://pantip.com/topic/34521625,168,2,2015-12-04T23:36:00.000000+0642
284,40595103,เพื่อนๆ เบื่อบังคับ outing บริษัทกันบ้างไหม? ทำไมต้องบังคับ,https://pantip.com/topic/40595103,106,7,2021-03-21T19:26:00.000000+0642
285,39361480,ผมตกงานแล้วหันมาขับ Grab ได้เงิน 3-4หมื่น/เดือน เวิร์คดีนะ,https://pantip.com/topic/39361480,86,119,2019-10-29T15:19:00.000000+0642
286,35275303,สมัครงานแล้วให้รอติดต่อกลับ รอนานแค่ไหนกันบ้างค่ะ,https://pantip.com/topic/35275303,105,0,2016-06-15T17:09:00.000000+0642
